{
  "$schema": "https://json-schema.org/draft/2020-12/schema",
  "$id": "https://mandolin.github.io/HIA-Documentation/schemas/hia-htmdoc-extraction-1.0.0.schema.json",
  "type": "object",
  "required": [
    "contract",
    "contractVersion",
    "producer",
    "profile",
    "source",
    "symbols",
    "annotations",
    "diagnostics",
    "sourceMap"
  ],
  "additionalProperties": true,
  "properties": {
    "contract": {
      "const": "hia-htmdoc-extraction"
    },
    "contractVersion": {
      "const": "1.0.0"
    },
    "producer": {
      "$ref": "#/$defs/producer"
    },
    "profile": {
      "$ref": "#/$defs/profile"
    },
    "source": {
      "$ref": "#/$defs/source"
    },
    "symbols": {
      "type": "array",
      "items": {
        "$ref": "#/$defs/symbol"
      }
    },
    "annotations": {
      "type": "array",
      "items": {
        "type": "object"
      }
    },
    "diagnostics": {
      "type": "array",
      "items": {
        "$ref": "#/$defs/diagnostic"
      }
    },
    "sourceMap": {
      "type": "object"
    },
    "metadata": {
      "type": "object"
    }
  },
  "$defs": {
    "nonEmptyString": {
      "type": "string",
      "minLength": 1
    },
    "producer": {
      "type": "object",
      "required": [
        "name",
        "version"
      ],
      "additionalProperties": true,
      "properties": {
        "name": {
          "$ref": "#/$defs/nonEmptyString"
        },
        "version": {
          "$ref": "#/$defs/nonEmptyString"
        }
      }
    },
    "profile": {
      "type": "object",
      "required": [
        "name",
        "version"
      ],
      "additionalProperties": true,
      "properties": {
        "name": {
          "$ref": "#/$defs/nonEmptyString"
        },
        "version": {
          "const": "1.0.0"
        }
      }
    },
    "source": {
      "type": "object",
      "required": [
        "kind",
        "path"
      ],
      "additionalProperties": true,
      "properties": {
        "kind": {
          "$ref": "#/$defs/nonEmptyString"
        },
        "path": {
          "$ref": "#/$defs/nonEmptyString"
        },
        "sourcesContent": {
          "type": "string"
        }
      }
    },
    "sourcePosition": {
      "type": "object",
      "required": [
        "line"
      ],
      "additionalProperties": true,
      "properties": {
        "line": {
          "type": "integer",
          "minimum": 1
        },
        "column": {
          "type": "integer",
          "minimum": 1
        }
      }
    },
    "sourceRange": {
      "anyOf": [
        {
          "type": "null"
        },
        {
          "type": "object",
          "required": [
            "start"
          ],
          "additionalProperties": true,
          "properties": {
            "start": {
              "$ref": "#/$defs/sourcePosition"
            },
            "end": {
              "$ref": "#/$defs/sourcePosition"
            }
          }
        }
      ]
    },
    "symbol": {
      "type": "object",
      "required": [
        "id",
        "kind",
        "name",
        "source"
      ],
      "additionalProperties": true,
      "properties": {
        "id": {
          "$ref": "#/$defs/nonEmptyString"
        },
        "kind": {
          "enum": [
            "html-component",
            "html-element",
            "html-template",
            "html-attribute",
            "html-slot",
            "html-event",
            "html-style-hook",
            "html-a11y-note",
            "html-example"
          ]
        },
        "name": {
          "$ref": "#/$defs/nonEmptyString"
        },
        "parentId": {
          "anyOf": [
            {
              "$ref": "#/$defs/nonEmptyString"
            },
            {
              "type": "null"
            }
          ]
        },
        "summary": {
          "type": [
            "string",
            "null"
          ]
        },
        "source": {
          "type": "object",
          "required": [
            "path"
          ],
          "additionalProperties": true,
          "properties": {
            "path": {
              "$ref": "#/$defs/nonEmptyString"
            },
            "range": {
              "$ref": "#/$defs/sourceRange"
            }
          }
        },
        "annotation": {
          "type": "object"
        },
        "metadata": {
          "type": "object"
        }
      }
    },
    "diagnostic": {
      "type": "object",
      "required": [
        "code",
        "message",
        "severity"
      ],
      "additionalProperties": true,
      "properties": {
        "code": {
          "$ref": "#/$defs/nonEmptyString"
        },
        "message": {
          "$ref": "#/$defs/nonEmptyString"
        },
        "severity": {
          "enum": [
            "info",
            "warning",
            "error"
          ]
        },
        "path": {
          "$ref": "#/$defs/nonEmptyString"
        },
        "data": {
          "type": "object"
        }
      }
    }
  }
}
